image_url;title;author;category
http://ecx.images-amazon.com/images/I/41cuXWA04fL.jpg;Seneca: Epistles 66-92 (Loeb No. 76);Seneca;Literature & Fiction
http://ecx.images-amazon.com/images/I/51z7tPa230L.jpg;Classics of Buddhism and Zen, Volume 1: The Collected Translations of Thomas Cleary;Thomas Cleary;Religion & Spirituality
http://ecx.images-amazon.com/images/I/51pGeuuTZeL.jpg;The Elfrida Goto Trilogy (The Solarian War Saga Books 1-3): Three Full-Length Thrilling Space Opera Novels;Felix R. Savage;Science Fiction & Fantasy
http://ecx.images-amazon.com/images/I/41a6jrneZ5L.jpg;Vital Breath of the Dao: Chinese Shamanic Tiger Qigong;Zhongxian Wu;Religion & Spirituality
http://ecx.images-amazon.com/images/I/6195WV%2B1EaL.jpg;Crazy Horse's Girlfriend;Erika T. Wurth;Literature & Fiction
http://ecx.images-amazon.com/images/I/51M-EyTNmvL.jpg;The Gangster (An Isaac Bell Adventure);Clive Cussler;Mystery, Thriller & Suspense
http://ecx.images-amazon.com/images/I/51qpv-%2BV9%2BL.jpg;The White Queen (The Cousins' War);Philippa Gregory;Romance
http://ecx.images-amazon.com/images/I/41268G4J0QL.jpg;Journey from the Land of No: A Girlhood Caught in Revolutionary Iran;Roya Hakakian;Religion & Spirituality
http://ecx.images-amazon.com/images/I/41aM7wyC7RL.jpg;Looney Bin Incorporated;Marietta Rodgers;Literature & Fiction
http://ecx.images-amazon.com/images/I/51v41waz3TL.jpg;The Courts Of Idleness (B-Berry Pleydell);Dornford Yates;Literature & Fiction
http://ecx.images-amazon.com/images/I/51jVcF8YHNL.jpg;The Inheritor: Book Six of The Marketplace Series;Laura Antoniou;Romance
http://ecx.images-amazon.com/images/I/51YsvDPxuuL.jpg;The Maverick of Copper Creek (Copper Creek Cowboys);R.C. Ryan;Romance
http://ecx.images-amazon.com/images/I/41V8BFqBMnL.jpg;Reincarnation and Karma: How They Really Affect Us: The Eastern Explanation of Our Past and Future Lives and Good or Bad Experiences;Stephen Knapp;Religion & Spirituality
http://ecx.images-amazon.com/images/I/51CsAYAoAoL.jpg;Norcal 2025;Bill Garwin;Science Fiction & Fantasy
http://ecx.images-amazon.com/images/I/41dESb94nVL.jpg;For the Love of 2am: Poetry For Insomniacs;Zena A. White;Literature & Fiction
http://ecx.images-amazon.com/images/I/51kwubDrxcL.jpg;A House Divided;Robert Whitlow;Mystery, Thriller & Suspense
http://ecx.images-amazon.com/images/I/41yJr7ylM7L.jpg;Fallacies of the Anti Hadith argument;Mr Zubair Ali;Religion & Spirituality
http://ecx.images-amazon.com/images/I/41Qjb7XPC1L.jpg;The Name of the Dead: Hieroglyphic Inscriptions of the Treasures of Tutankhamun Translated;Hany Assaad;Religion & Spirituality
http://ecx.images-amazon.com/images/I/514y1ZCphZL.jpg;A Wild Sheep Chase: A Novel;Haruki Murakami;Mystery, Thriller & Suspense
http://ecx.images-amazon.com/images/I/51frnuDeUrL.jpg;Heaven and Earth (Three Sisters Island Trilogy);Nora Roberts;Romance
http://ecx.images-amazon.com/images/I/61Yo1Mi1JOL.jpg;She Appears! Encounters with Kwan Yin, Goddess of Compassion;Sandy Boucher;Religion & Spirituality
http://ecx.images-amazon.com/images/I/51AtTOlRmvL.jpg;The Cambridge Companion to the Greek and Roman Novel (Cambridge Companions to Literature);;Literature & Fiction
http://ecx.images-amazon.com/images/I/31VezQMyQcL.jpg;Oxford Studies in Philosophy of Religion Volume 6;;Religion & Spirituality
http://ecx.images-amazon.com/images/I/41k9h2wMPEL.jpg;License to Lie;Terry Ambrose;Mystery, Thriller & Suspense
http://ecx.images-amazon.com/images/I/51Oib1mQuuL.jpg;True Honor (Uncommon Heroes, Book 3);Dee Henderson;Romance
http://ecx.images-amazon.com/images/I/51ZLb43JhhL.jpg;A Replacement Life: A Novel (P.S.);Boris Fishman;Literature & Fiction
http://ecx.images-amazon.com/images/I/61HmWM642cL.jpg;Strands of Sorrow (Black Tide Rising);John Ringo;Science Fiction & Fantasy
http://ecx.images-amazon.com/images/I/51UsMAGYuyL.jpg;Shadow Fall (Tracers);Laura Griffin;Romance
http://ecx.images-amazon.com/images/I/41R1e%2BfhjEL.jpg;The Lord of the Rings 1954-2004: Scholarship in Honor of Richard E. Blackwelder;;Science Fiction & Fantasy
http://ecx.images-amazon.com/images/I/51sq9DvAqEL.jpg;The Lands of Ice and Fire (A Game of Thrones): Maps from King's Landing to Across the Narrow Sea;George R. R. Martin;Science Fiction & Fantasy
http://ecx.images-amazon.com/images/I/51G2Y9R1QFL.jpg;Clanbook: Malkavian, Revised Edition (Vampire: The Masquerade Clanbooks);Jess Heinig;Science Fiction & Fantasy
http://ecx.images-amazon.com/images/I/41SrzTpjSTL.jpg;Intermarriage and Conversion: A Halakhic Solution;J. Simcha Cohen;Religion & Spirituality
http://ecx.images-amazon.com/images/I/51LrGk8EeML.jpg;Wicked Autumn: A Max Tudor Novel;G. M. Malliet;Mystery, Thriller & Suspense
http://ecx.images-amazon.com/images/I/51s3kqz2O8L.jpg;The Big Book of Building: Everything Minecraft®™ Imagine it… Create it… Build it;Triumph Books;Science Fiction & Fantasy
http://ecx.images-amazon.com/images/I/51I7IOwB%2BqL.jpg;The Sonnets and a Lover's Complaint (Hardcover Classics);William Shakespeare;Literature & Fiction
http://ecx.images-amazon.com/images/I/41UAKMfvDHL.jpg;Gandhi's Ascetic Activism: Renunciation and Social Action;Veena R. Howard;Religion & Spirituality
http://ecx.images-amazon.com/images/I/51g7xyZDGnL.jpg;Baha'I Prayers: A Selection of Prayers;Baha'u'llah;Religion & Spirituality
http://ecx.images-amazon.com/images/I/51usO70-1UL.jpg;The Rise of Renegade X (Volume 1);Chelsea M Campbell;Science Fiction & Fantasy
http://ecx.images-amazon.com/images/I/51b5De9ps8L.jpg;All My Friends Are Superheroes;Andrew Kaufman;Science Fiction & Fantasy
http://ecx.images-amazon.com/images/I/51rSqE9IomL.jpg;The Best American Essays of the Century (The Best American Series);;Literature & Fiction
http://ecx.images-amazon.com/images/I/51oUECPwz%2BL.jpg;The Melancholy Death of Oyster Boy & Other Stories;Tim Burton;Mystery, Thriller & Suspense
http://ecx.images-amazon.com/images/I/51Ka9EAQUeL.jpg;Guide to the Bodhisattva's Way of Life: How to enjoy a life of great meaning and altruism;Shantideva;Religion & Spirituality
http://ecx.images-amazon.com/images/I/51wLqV73eDL.jpg;The Sniper and the Wolf: A Sniper Elite Novel;Scott McEwen;Mystery, Thriller & Suspense
http://ecx.images-amazon.com/images/I/51AONlGu%2BSL.jpg;In Pursuit of Spenser: Mystery Writers on Robert B. Parker and the Creation of an American Hero;;Mystery, Thriller & Suspense
http://ecx.images-amazon.com/images/I/51nscf59YsL.jpg;For Elise;Sarah M. Eden;Romance
http://ecx.images-amazon.com/images/I/51HTNAT0JVL.jpg;The Lord of the Rings: The Fellowship of the Rings: A Strategy Battle Game;Marc Gascoigne;Science Fiction & Fantasy
http://ecx.images-amazon.com/images/I/41dsZl94ZML.jpg;The Last Victim: A Novel (Dr. Charlotte Stone);Karen Robards;Mystery, Thriller & Suspense
http://ecx.images-amazon.com/images/I/51eikBd88JL.jpg;299 Days: The 43 Colonels (Volume 10);Glen Tate;Science Fiction & Fantasy
http://ecx.images-amazon.com/images/I/51o2UG3sp3L.jpg;A Clash of Kings (A Song of Ice and Fire, Book 2);George R. R. Martin;Science Fiction & Fantasy
http://ecx.images-amazon.com/images/I/41YYXuupRML.jpg;Der Kleine Prinz (German);Antoine de Saint-ExupÃ©ry;Literature & Fiction
http://ecx.images-amazon.com/images/I/5102S0GP5LL.jpg;The Rise of the Empire: Star Wars: Featuring the novels Star Wars: Tarkin, Star Wars: A New Dawn, and 3 all-new short stories;John Jackson Miller;Science Fiction & Fantasy
http://ecx.images-amazon.com/images/I/51luHH98Z3L.jpg;Dorothy L. Sayers: The Complete Stories;Dorothy L. Sayers;Mystery, Thriller & Suspense
http://ecx.images-amazon.com/images/I/51PtnNC45mL.jpg;Spiritual Astrology: A Path to Divine Awakening;Jan Spiller;Religion & Spirituality
http://ecx.images-amazon.com/images/I/51irExW3bpL.jpg;The Fisherman: A Novel;Larry Huntsperger;Romance
http://ecx.images-amazon.com/images/I/51sbcSrIu9L.jpg;Le Morte Darthur (Norton Critical Editions);Sir Thomas Malory;Literature & Fiction
http://ecx.images-amazon.com/images/I/51knps4zMHL.jpg;Hiring the Heavens: A Practical Guide to Developing Working Relationships with the Spirits of Creation;Jean Slatter;Religion & Spirituality
http://ecx.images-amazon.com/images/I/515lKF3VPOL.jpg;Alan Price and The Colossus of Rhodes (The Nephilim Chronicles ) (Volume 1);Jonathan Yanez;Mystery, Thriller & Suspense
http://ecx.images-amazon.com/images/I/51ISJZX4GXL.jpg;Highland Harmony: Avelina and Drew (Clan Grant Series) (Volume 8);Keira Montclair;Romance
http://ecx.images-amazon.com/images/I/51QRtiFZJtL.jpg;Eternity's Sunrise: The Imaginative World of William Blake;Leo Damrosch;Literature & Fiction
http://ecx.images-amazon.com/images/I/51um2nBNdoL.jpg;Celtic Viking: Heart of the Battle Series, Book 1;Lexy Timms;Romance
http://ecx.images-amazon.com/images/I/61SeZb2MvjL.jpg;A Lady at Willowgrove Hall (Whispers On The Moors);Sarah E. Ladd;Romance
http://ecx.images-amazon.com/images/I/51mGJ4PmMzL.jpg;Star Wars: The Jedi Path;Daniel Wallace;Science Fiction & Fantasy
http://ecx.images-amazon.com/images/I/61OF0-7LtuL.jpg;Sixth World Almanac (Shadowrun (Catalyst Hardcover));John Schmidt;Science Fiction & Fantasy
http://ecx.images-amazon.com/images/I/51g6OhERteL.jpg;Soul Surfer: A True Story of Faith, Family, and Fighting to Get Back on the Board;Bethany Hamilton;Literature & Fiction
http://ecx.images-amazon.com/images/I/41rBl7D9YeL.jpg;The Trust Company;Paul N Stam;Mystery, Thriller & Suspense
http://ecx.images-amazon.com/images/I/410oYwwjssL.jpg;The Words of Gandhi (Newmarket Words Of Series);Mahatma Gandhi;Religion & Spirituality
http://ecx.images-amazon.com/images/I/41ST0F0KHEL.jpg;Sherlock Holmes: The Major Stories with Contemporary Critical Essays (Bedford Series in History & Culture);Arthur Conan Doyle;Mystery, Thriller & Suspense
http://ecx.images-amazon.com/images/I/51-RntCdC-L.jpg;This Book Is Full of Spiders: Seriously, Dude, Don't Touch It (John Dies at the End);David Wong;Literature & Fiction
http://ecx.images-amazon.com/images/I/51PTGUmpY3L.jpg;The Time Keeper;Mitch Albom;Literature & Fiction
http://ecx.images-amazon.com/images/I/51W2%2B01mkVL.jpg;Cook's Big Day: An Angie Amalfi Mystery (The Angie Amalfi Mysteries) (Volume 16);Joanne Pence;Mystery, Thriller & Suspense
http://ecx.images-amazon.com/images/I/51P9WLKoZlL.jpg;The Rewind Files;Claire Willett;Science Fiction & Fantasy
http://ecx.images-amazon.com/images/I/41fBUGHemXL.jpg;On Conan Doyle: Or, The Whole Art of Storytelling (Writers on Writers);Michael Dirda;Mystery, Thriller & Suspense
http://ecx.images-amazon.com/images/I/612wLxgw1QL.jpg;Broken Earth (Savage Worlds);Matthew J. Hanson;Science Fiction & Fantasy
http://ecx.images-amazon.com/images/I/51tXQU%2BZhDL.jpg;Put Out More Flags;Evelyn Waugh;Literature & Fiction
http://ecx.images-amazon.com/images/I/51cmfPPisHL.jpg;Proof of Innocence (Capitol K-9 Unit);Lenora Worth;Romance
http://ecx.images-amazon.com/images/I/51CzNu02ISL.jpg;The Shell Collector: Stories;Anthony Doerr;Literature & Fiction
http://ecx.images-amazon.com/images/I/5149VTiHKrL.jpg;Hell or High Water (The Deep Six);Julie Ann Walker;Romance
http://ecx.images-amazon.com/images/I/513U9pJzm7L.jpg;Pathfinder Pawns: Giantslayer Pawn Collection;Rob McCreary;Science Fiction & Fantasy
http://ecx.images-amazon.com/images/I/41uhmxTam-L.jpg;Gems from the Equinox: Instructions by Aleister Crowley for His Own Magical Order;Aleister Crowley;Religion & Spirituality
http://ecx.images-amazon.com/images/I/51TajDxQ0eL.jpg;Sign of a Promise and Other Stories (Mandate Series);James Calvin Schaap;Religion & Spirituality
http://ecx.images-amazon.com/images/I/51pum0eWe4L.jpg;A Partner in Holiness: Deepening Mindfulness, Practicing Compassion and Enriching Our Lives Through the Wisdom of R. Levi Yitzhak of Berdichev's, Vol. 2  (Institute for Jewish Spirituality);Rabbi Jonathan P. Slater DMin;Religion & Spirituality
http://ecx.images-amazon.com/images/I/51y%2BysN7MPL.jpg;Agent to the Stars;John Scalzi;Science Fiction & Fantasy
http://ecx.images-amazon.com/images/I/51T3GSdb4hL.jpg;My Fair Gentleman (Proper Romance) (A Proper Romance);Nancy Campbell Allen;Romance
http://ecx.images-amazon.com/images/I/51jIUahXjDL.jpg;A Bridge Through Time: Book 1 of The Thistle & Hive Series;Jennae Vale;Romance
http://ecx.images-amazon.com/images/I/61dX53tzpPL.jpg;Greenwode: The Wode, Book 1;J Tullos Hennig;Romance
http://ecx.images-amazon.com/images/I/51k-RKw%2BJML.jpg;Bella's Christmas Bake Off: A fabulously funny, feel good Christmas read;Sue Watson;Romance
http://ecx.images-amazon.com/images/I/51tuZK1fOML.jpg;More Christmas on Stage: An Anthology of Royalty-Free Christmas Plays;Rhonda Wray;Literature & Fiction
http://ecx.images-amazon.com/images/I/51t2uBEMp3L.jpg;Love in Provence: Romantic Adventures in the South of France;Yvone Lenard;Romance
http://ecx.images-amazon.com/images/I/51w9-tFPSHL.jpg;The Welcome Committee of Butternut Creek: A Novel;Jane Myers Perrine;Romance
http://ecx.images-amazon.com/images/I/517YTQ0oXtL.jpg;The Man Who Smiled (Kurt Wallander Series);Henning Mankell;Mystery, Thriller & Suspense
http://ecx.images-amazon.com/images/I/412GcWvG%2BPL.jpg;When Zarathustra Spoke: The Reformation Of Neolithic Culture And Religion (Bibliotheca Iranica: Zoroastrian Studies);Mary Settegast;Religion & Spirituality
http://ecx.images-amazon.com/images/I/51G-4OL92ZL.jpg;The Magical Power of the Saints: Evocation and Candle Rituals;Rev Ray T. Malbrough;Religion & Spirituality
http://ecx.images-amazon.com/images/I/51TLjyIjU%2BL.jpg;Shadowrun: Third Edition (FPR25000);FanPro;Science Fiction & Fantasy
http://ecx.images-amazon.com/images/I/51GEXT3Y4RL.jpg;Doctor Zhivago (Everyman's Library);Boris Pasternak;Romance
http://ecx.images-amazon.com/images/I/51uNnIlIwrL.jpg;Literature and Its Writers: A Compact Introduction to Fiction, Poetry, and Drama;Ann Charters;Literature & Fiction
http://ecx.images-amazon.com/images/I/51e%2B0kvWt-L.jpg;Gray Mountain: A Novel;John Grisham;Mystery, Thriller & Suspense
http://ecx.images-amazon.com/images/I/51FB6K4S7WL.jpg;Challenge The Widow-Maker And Other Stories Of People In Peril;Clark Howard;Mystery, Thriller & Suspense
http://ecx.images-amazon.com/images/I/41pnyAVQMCL.jpg;Never Forget About Me;Joseph Starzyk;Literature & Fiction
http://ecx.images-amazon.com/images/I/51RxQEhtYyL.jpg;Her Final Breath (The Tracy Crosswhite Series);Robert Dugoni;Mystery, Thriller & Suspense
http://ecx.images-amazon.com/images/I/51uJz4Jd-hL.jpg;The Crime Wave: Collected Nonfiction (The Ace Performer Collection series);Dashiell Hammett;Mystery, Thriller & Suspense
